{
  "schemaVersion": 1,
  "id": "ai.tool-schema",
  "type": "foundation",
  "title": "工具模式：把可调用动作定义成窄契约",
  "domain": "agent",
  "track": "ai-basics",
  "skills": ["llm.applications", "agents.evaluation", "security.governance"],
  "level": "intermediate",
  "order": 84,
  "estimatedMinutes": 10,
  "content": {
    "simpleExplanation": "工具模式用明确名称、用途、参数类型、必填字段和约束向模型描述可请求动作，使执行器能拒绝歧义或越界输入，但真正的权限与幂等性仍由工具服务强制。",
    "analogy": "它像受控作业单，只允许填写设备编号、动作类型和批准凭证，不能在备注里夹带任意命令；技师仍须核对持有人权限，表单本身不会赋予开机资格。",
    "technicalExplanation": "模式应使用窄枚举、长度边界和明确格式，关闭不需要的额外字段，并将读写工具拆分；执行前还要做服务端业务校验、授权检查和参数规范化，版本变化需回归旧轨迹。",
    "example": "付款调整工具若只接收自由文本和客户端 approved 标志，模型可以生成看似合法却未绑定金额的调用；应定义金额、供应商、动作摘要和审批能力，并由 API 原子核验。",
    "commonMistakes": "把详细描述当作访问控制、允许任意键值对象、让一个工具同时查询和写入，或模式校验通过后直接执行都扩大风险；模型能选择工具不代表它有权使用工具。"
  },
  "relatedCases": [
    "agent-approval-boundary-bypass-001",
    "agent-tool-timeout-retry-001",
    "agent-tool-schema-enum-drift-001"
  ]
}
