{
  "schemaVersion": 1,
  "id": "agent-basic",
  "type": "foundation",
  "title": "Agent：在约束下规划并调用工具",
  "domain": "agent",
  "track": "ai-basics",
  "skills": ["agents.evaluation", "security.governance"],
  "level": "intermediate",
  "order": 28,
  "estimatedMinutes": 10,
  "content": {
    "simpleExplanation": "Agent 让模型在多步任务中选择行动、调用工具并根据结果继续；能力越强，错误操作的影响越大，因此权限、审批、预算和审计必须由系统强制。",
    "analogy": "Agent 像能使用公司系统的实习生：可以查资料和准备操作，但付款、删除等高风险动作仍需明确授权，且每一步都要留下可追溯记录。",
    "technicalExplanation": "Agent 循环通常包含观察、计划、工具选择、执行和状态更新。编排器负责工具白名单、参数校验、最大步数、超时、授权令牌与结果持久化。",
    "example": "界面等待人工审批，但异步回调先触发了高风险工具。应暂停执行，重现时序，并让服务端只接受绑定具体操作的一次性审批令牌。",
    "commonMistakes": "用 Prompt 写“务必等待审批”不能建立安全边界；客户端按钮也可被绕过。另一个误区是只评估最终回答，不检查工具调用轨迹和副作用。"
  },
  "relatedCases": ["agent-approval-boundary-bypass-001"]
}
