{
  "schemaVersion": 1,
  "id": "ai.agent-loop",
  "type": "foundation",
  "title": "Agent 循环：让每一步状态与副作用可控",
  "domain": "agent",
  "track": "ai-basics",
  "skills": [
    "agents.evaluation",
    "reliability.observability",
    "security.governance"
  ],
  "level": "intermediate",
  "order": 83,
  "estimatedMinutes": 10,
  "content": {
    "simpleExplanation": "Agent 循环在观察、计划、选择工具、执行和更新状态之间反复推进，编排器必须限制步数、时间与权限，并把审批、尝试和副作用作为可恢复状态而非提示文字。",
    "analogy": "它像值班工程师按运行手册逐步处置，每完成一步都记录结果再决定下一步；如果先启动维修再等待主管批准，或没确认上次是否成功就重做，流程本身会制造事故。",
    "technicalExplanation": "编排器应持久化运行与步骤标识、状态转换、工具参数摘要和结果分类，设置最大步数与总预算；写操作遇到超时要进入结果未知状态，先核对而非自动重新规划。",
    "example": "付款调整编排器在等待审批前就创建执行任务，拒绝回调到达时工具已成功；正确修复是让服务端审批能力成为进入执行状态的必要条件，并覆盖拒绝、超时与竞态。",
    "commonMistakes": "只看最终答复是否正确、把循环停止交给模型自觉、每轮暴露全部工具，或失败后从头重跑都会隐藏越权和重复副作用；评估必须检查完整轨迹与状态转换。"
  },
  "relatedCases": [
    "agent-approval-boundary-bypass-001",
    "agent-tool-timeout-retry-001",
    "multi-agent-delegation-loop-001"
  ]
}
