{
  "schemaVersion": 1,
  "id": "ai.tokenization-budget",
  "type": "foundation",
  "title": "分词预算：用实际 Token 约束请求成本",
  "domain": "ai-basics",
  "track": "ai-basics",
  "skills": ["llm.applications", "performance.scaling"],
  "level": "intermediate",
  "order": 71,
  "estimatedMinutes": 9,
  "content": {
    "simpleExplanation": "分词预算是在请求进入模型前按真实分词结果核算系统指令、历史、检索片段、工具结果和预留输出，让应用在窗口、延迟与显存限制内保住关键约束。",
    "analogy": "它像航空配载单，不能只看行李件数，还要逐件称重并给燃油和安全设备预留空间；提示中的每一段也要按实际 Token 计量，不能拿字符数猜测。",
    "technicalExplanation": "提示构建器应使用与线上模型匹配的分词器，记录各片段 Token 数、总输入、最大输出和截断原因，并在提交前执行硬上限与容量准入，而不是等模型或 GPU 报错。",
    "example": "退款助手加入长检索材料后，用户消息、政策和示例一起逼近窗口，旧逻辑从开头截断了高优先级政策；修复时应先保护政策段，再压缩历史并为回答固定预留。",
    "commonMistakes": "常见错误是用字符数乘固定比例、忽略中文和代码切分差异、只统计输入而不预留输出，或在并发长请求下仍按请求数限流，这会把上下文错误放大为显存故障。"
  },
  "relatedCases": [
    "llm-prompt-context-order-001",
    "inference-gpu-oom-capacity-001"
  ]
}
