{
  "schemaVersion": 1,
  "id": "ai.hybrid-search-reranking",
  "type": "foundation",
  "title": "混合检索与重排：召回互补候选再精排",
  "domain": "rag",
  "track": "ai-basics",
  "skills": ["rag.search", "agents.evaluation", "performance.scaling"],
  "level": "intermediate",
  "order": 81,
  "estimatedMinutes": 11,
  "content": {
    "simpleExplanation": "混合检索结合关键词对编号和原词的精确命中与向量检索的语义召回，再让重排器按查询逐项排序，从而改善证据质量但仍受版本、授权和延迟预算约束。",
    "analogy": "它像让一名档案员按编号查目录，另一名按主题找相近材料，再由负责人阅读候选决定先后；候选来源可以互补，却不能把已撤销或过期文件重新排成合法。",
    "technicalExplanation": "系统需要在过滤后的同一合法范围内运行稀疏与稠密召回，使用可解释的融合规则去重，再以版本化重排模型处理有限候选，并分别监控各路贡献、排序质量和尾延迟。",
    "example": "维护程序查询既包含精确设备编号又包含自然语言故障描述，混合召回可减少漏检；但多区域快照不一致时必须先绑定版本，否则重排仍可能把西区旧程序放在首位。",
    "commonMistakes": "把两路分数直接相加而不归一、在全库召回后才做授权过滤、让重排器处理过多候选，或只看最终点击率都会掩盖单路失效和陈旧引用。"
  },
  "relatedCases": [
    "multi-region-rag-consistency-001",
    "rag-stale-policy-cache-001",
    "rag-hybrid-search-product-code-001"
  ]
}
