{
  "schemaVersion": 1,
  "id": "fde.evidence-first-debugging",
  "type": "foundation",
  "title": "证据优先调试：先缩小问题再改变系统",
  "domain": "fde-methodology",
  "track": "computer-basics",
  "skills": ["reliability.observability", "software.foundations"],
  "level": "beginner",
  "order": 94,
  "estimatedMinutes": 10,
  "content": {
    "simpleExplanation": "证据优先调试通过复现、对照、日志、指标和最小实验逐步排除假设，并在每次变更前说明预期观察，避免同时修改多处后失去因果关系。",
    "analogy": "它像排查家中跳闸时逐个断开电器并观察开关，而不是把所有插座和电线一起更换，否则即使恢复供电也不知道真正故障在哪里。",
    "technicalExplanation": "调试循环包括定义症状、建立时间线、提出可证伪假设、选择区分度最高的检查、记录结果并更新假设；生产操作还需控制影响与回滚。",
    "example": "请求偶发失败时，FDE 先用关联标识连接网关、应用和依赖日志，确认失败只对应旧配置实例，再进行单实例替换而不是全局提高超时。",
    "commonMistakes": "凭经验直接重启、一次改多个参数、只收集成功请求或在日志中输出秘密，都会破坏证据链；应使用脱敏样本和最小可逆实验。"
  },
  "relatedCases": [
    "observability-correlation-id-001",
    "python-config-precedence-001"
  ]
}
