{
  "schemaVersion": 1,
  "id": "api-basic",
  "type": "foundation",
  "title": "API：系统之间可验证的协作契约",
  "domain": "computer-basics",
  "track": "computer-basics",
  "skills": ["api.integration"],
  "level": "beginner",
  "order": 6,
  "estimatedMinutes": 7,
  "content": {
    "simpleExplanation": "API 定义一个系统怎样请求另一个系统完成操作，包括地址、参数、身份、返回值和错误；它是双方共同遵守的契约，而不只是一个网址。",
    "analogy": "API 像快递柜的操作面板：你要选择正确柜门、提供有效取件码，并理解成功或失败提示。随便输入一个号码并不能取得包裹。",
    "technicalExplanation": "API 契约包含方法、路径、请求与响应 Schema、认证授权、错误语义及重试规则。可靠集成还要定义超时、幂等性、版本兼容和可观测字段。",
    "example": "客户端能获取 OAuth 令牌，但调用新接口返回权限不足。应比较接口要求的 scope 与令牌声明，以最小权限申请正确范围，而不是绕过认证或扩大全部权限。",
    "commonMistakes": "只凭状态码猜原因、把认证和授权混为一谈，或遇到失败就无限重试，都会放大问题。调试时应保留脱敏请求标识并按契约逐项核对。"
  },
  "relatedCases": ["api-oauth-scope-mismatch-001"]
}
