{
  "schemaVersion": 1,
  "id": "api.retry-backoff-jitter",
  "type": "foundation",
  "title": "重试退避与抖动：避免恢复流量同步冲击",
  "domain": "api",
  "track": "network-api",
  "skills": ["api.integration", "reliability.observability"],
  "level": "intermediate",
  "order": 59,
  "estimatedMinutes": 10,
  "content": {
    "simpleExplanation": "指数退避让连续重试逐渐拉开间隔，随机抖动让大量客户端不在同一时刻再次请求，两者结合可减少故障期间的同步流量冲击。",
    "analogy": "散场时所有车辆若每隔固定一分钟同时冲向出口，拥堵会反复出现；让等待时间逐步增加并各自略有随机差异，车流才有机会真正疏散。",
    "technicalExplanation": "客户端只对明确的瞬时错误重试，按尝试次数扩大等待上限，再在区间内加入随机值，同时受最大次数、总期限和服务端 Retry-After 约束。",
    "example": "FDE 发现一批 Agent 工具调用在下游短暂 503 后每秒整齐重试，恢复节点立刻再次过载。加入带抖动的指数退避和总预算后，成功率回升且峰值下降。",
    "commonMistakes": "固定间隔、没有抖动或每层组件各自重试，会把少量失败放大成重试风暴。退避也不能解决永久错误，写操作还必须先确认幂等语义。"
  },
  "relatedCases": [
    "agent-tool-timeout-retry-001",
    "third-party-retry-storm-001"
  ]
}
