{
  "schemaVersion": 1,
  "id": "fde.problem-scoping",
  "type": "foundation",
  "title": "问题界定：先确定真正要解决的边界",
  "domain": "fde-methodology",
  "track": "computer-basics",
  "skills": ["customer.discovery", "fde.adoption"],
  "level": "beginner",
  "order": 91,
  "estimatedMinutes": 9,
  "content": {
    "simpleExplanation": "问题界定是把客户现象转换成明确的用户、场景、影响、约束和非目标，从而避免团队用昂贵方案解决一个尚未被证据确认的问题。",
    "analogy": "它像医生问诊时先确认疼痛位置、持续时间和诱因，而不是听到一句不舒服就安排手术；边界越清楚，后续检查越有针对性。",
    "technicalExplanation": "可靠的范围说明至少记录受影响用户、触发条件、期望行为、当前行为、可验证影响和明确非目标，并把未知项与已确认事实分开维护。",
    "example": "客户说搜索不好用时，FDE 先按租户、查询类型和时间窗口拆分失败样本，确认问题只发生在权限迁移后的政策查询，再限定首轮修复范围。",
    "commonMistakes": "常见错误是把客户提出的方案直接当需求、把所有相关痛点塞入同一项目，或在缺少影响数据时承诺交付日期；应先共同确认可验证边界。"
  },
  "relatedCases": ["fde-pilot-scope-control-001"]
}
