{
  "schemaVersion": 1,
  "id": "computer.log-correlation",
  "type": "foundation",
  "title": "日志关联：还原一次请求的跨服务路径",
  "domain": "computer-basics",
  "track": "computer-basics",
  "skills": ["reliability.observability"],
  "level": "intermediate",
  "order": 40,
  "estimatedMinutes": 10,
  "content": {
    "simpleExplanation": "日志关联通过稳定传播的请求标识把网关、应用、异步任务和下游服务的事件串成同一条执行链，使 FDE 能在高并发时间窗口中定位请求在哪一跳丢失或重复。",
    "analogy": "关联标识像快递包裹贯穿分拨站的运单号，每个站点都记录同一个号码，才能还原去向和停留时间。只靠大致时间寻找包裹，在同一分钟处理数百件时很容易把不同客户的记录拼错。",
    "technicalExplanation": "入口应生成或校验唯一标识，通过约定请求头和异步消息元数据向下游传播，并写入结构化日志的固定字段。服务内部还可把它绑定到日志上下文；采集系统需保持字段可检索，同时对标识长度、可信边界和敏感数据进行限制。",
    "example": "关联标识案例中，网关已经生成请求标识，但订单接口和调度服务都记录为缺失，说明问题位于传播或日志上下文绑定而非时钟。应先在一个低风险请求上验证逐跳透传，再观察重复调度能否被完整关联。",
    "commonMistakes": "增加更多无关联日志只会扩大搜索噪声，用用户姓名或令牌充当关联键还会造成隐私和安全风险。另一个误区是只在同步请求头传播而忽略队列消息，导致链路在异步边界断开；应使用随机、非敏感且全程一致的标识。"
  },
  "relatedCases": ["observability-correlation-id-001"]
}
