{
  "schemaVersion": 1,
  "id": "computer.data",
  "type": "foundation",
  "title": "数据：带有语义与质量约束的事实",
  "domain": "computer-basics",
  "track": "computer-basics",
  "skills": ["data.engineering"],
  "level": "beginner",
  "order": 4,
  "estimatedMinutes": 7,
  "content": {
    "simpleExplanation": "数据不是孤立的字符和数字；字段含义、来源、时间、是否可空以及谁能访问，都会决定它能否被正确使用；FDE 要先确认语义，再处理格式。",
    "analogy": "一张没有单位和日期的体检表很难判断健康状况。数据也一样：数值 42 只有配合字段定义、单位、采集时间和来源，才成为可用事实。",
    "technicalExplanation": "数据在系统间通过 Schema 约束类型、必填性和兼容规则，并由血缘记录来源与变换。质量验证应覆盖完整性、准确性、及时性、唯一性以及授权范围。",
    "example": "上游把原本必填的地址字段改为可空，ETL 仍直接调用字符串函数而失败。安全做法是确认业务语义，显式处理空值，并比较修复前后的行数和缺失率。",
    "commonMistakes": "常见错误是遇到空值就随意填默认字符串，或只让任务跑完而不核对输出质量。这样可能掩盖真实缺失、破坏统计口径，并把错误传播到下游。"
  },
  "relatedCases": ["etl-schema-drift-null-field-001"]
}
