{
  "schemaVersion": 1,
  "id": "api.correlation-id",
  "type": "foundation",
  "title": "Correlation ID：贯穿调用链关联证据",
  "domain": "api",
  "track": "network-api",
  "skills": ["api.integration", "reliability.observability"],
  "level": "intermediate",
  "order": 69,
  "estimatedMinutes": 9,
  "content": {
    "simpleExplanation": "Correlation ID 为一次跨服务业务流程提供可传播的关联标识，使网关、API、队列和工作器中的日志与指标能够围绕同一请求汇聚。",
    "analogy": "关联 ID 像跨部门工单号，客服、仓库和财务各有自己的记录格式，只要都保留同一工单号，就能把分散证据拼成完整处理轨迹。",
    "technicalExplanation": "入口可接受符合策略的外部标识或生成新值，并在同步头部、异步消息和结构化日志中传播。它用于关联而非认证，仍需配合本地请求 ID 和追踪上下文。",
    "example": "FDE 调查间歇性 502 时发现，网关生成关联 ID 后下游 SDK 没有继续传递，日志只能按时间猜测。补齐传播并回显响应头后，迅速定位到故障实例。",
    "commonMistakes": "每经过一层就生成全新 ID 会切断链路，完全信任用户提供的超长值又可能污染日志。标识不应包含邮箱、令牌或业务敏感数据，也不能代替权限校验。"
  },
  "relatedCases": ["observability-correlation-id-001"]
}
