{
  "schemaVersion": 1,
  "id": "api.idempotency-key",
  "type": "foundation",
  "title": "幂等键：让同一业务意图可安全重放",
  "domain": "api",
  "track": "network-api",
  "skills": ["api.integration", "reliability.observability"],
  "level": "intermediate",
  "order": 67,
  "estimatedMinutes": 11,
  "content": {
    "simpleExplanation": "幂等键为一次业务意图提供稳定标识，客户端重试时沿用同一键，服务端即可返回首次结果或继续同一处理而不重复产生副作用。",
    "analogy": "幂等键像转账流水号，网络卡顿后再次提交同一流水号，银行识别为同一笔指令；若每次都换新号码，就会被当成多笔转账。",
    "technicalExplanation": "服务端应将键、调用者、规范化请求摘要和结果原子关联，并规定保留窗口。相同键配不同载荷应报冲突，处理中请求也需返回明确可查询状态。",
    "example": "FDE 处理 Agent 创建工单超时问题时发现，每次重试都生成新幂等键，后端因此创建多条记录。改为从业务意图生成稳定键并查询首次结果后消除重复。",
    "commonMistakes": "仅在单实例内存保存键无法抵抗重启与并发，先执行写入再记录键也存在竞态。幂等键不是永久业务 ID，需要明确作用域、过期窗口和冲突行为。"
  },
  "relatedCases": [
    "agent-tool-timeout-retry-001",
    "api-webhook-idempotency-001"
  ]
}
